{
  "$schema": "./runic.compatibility-set.schema.json",
  "schemaVersion": 1,
  "id": "runic-1.0-preview.1",
  "releaseTrainVersion": "1.0.0-preview.1",
  "publication": "forbidden",
  "toolchain": {
    "dotnetSdk": "10.0.302",
    "node": "24.18.0",
    "bun": "1.4.0",
    "npm": "11.16.0",
    "pnpm": "11.25.0"
  },
  "languageProfiles": {
    "v1": [
      { "language": "csharp", "role": "application-backend", "state": "supported" },
      { "language": "typescript-effect", "role": "frontend", "state": "supported" }
    ],
    "postV1": [
      { "language": "rust", "role": "native-and-backend", "state": "unassigned" },
      { "language": "cpp", "role": "native-and-backend", "state": "unassigned" }
    ]
  },
  "platformProfiles": ["linux-x64", "win-x64", "osx-x64", "osx-arm64"],
  "sources": [
    { "repository": "runic-desktop", "url": "https://github.com/Runic-Artifex/runic-desktop", "revision": "ffe377a4d4eb798e3487670b2a079c6aebadeaa4" },
    { "repository": "runic-toolkit", "url": "https://github.com/Runic-Artifex/runic-toolkit", "revision": "62e6aa8d1aa1c4b5405cd3f45eec2231e69fae08" },
    { "repository": "runic-assets", "url": "https://github.com/Runic-Artifex/runic-assets", "revision": "a41596944d746196295fd0e220c6a1a3fbbc5956" },
    { "repository": "runic-translations", "url": "https://github.com/Runic-Artifex/runic-translations", "revision": "6d1e742a6a053f1747f0497d73d0f5f97b4ecd1b" },
    { "repository": "runic-translations-editor", "url": "https://github.com/Runic-Artifex/runic-translations-editor", "revision": "f5cab0854feb62314cedba99d37f6d57565fd46c" },
    { "repository": "runic-svelte", "url": "https://github.com/Runic-Artifex/runic-svelte", "revision": "0ae2f35e3ac78bf89723946073800b9206a45c9a" },
    { "repository": "runic-vite", "url": "https://github.com/Runic-Artifex/runic-vite", "revision": "a24af5478954309bd31dffd6b0bcba0b2e978fc7" },
    { "repository": "runic-toolkit-examples", "url": "https://github.com/Runic-Artifex/runic-toolkit-examples", "revision": "40e0b2778e142809e1baf60ff413b24a9a96c9d4" },
    { "repository": "runic-command-line", "url": "https://github.com/Runic-Artifex/runic-command-line", "revision": "5d6a9aa6be25e19640c797730c5984cad9c17bd5" }
  ],
  "contracts": [
    { "id": "runic-desktop-presentation", "repository": "runic-desktop", "path": "contract", "algorithm": "sha256-git-file-set-v1", "sha256": "ab7081368d12f0a12556e1c125643fc881bee125c237a6b126314401673a8eeb" },
    { "id": "runic-application-bridge", "repository": "runic-toolkit", "path": "protocol/application-bridge", "algorithm": "sha256-git-file-set-v1", "sha256": "7bd6a593bcd869d6a7dfe35f0f1b8816379893a0b418c806370d4145cf72db61" },
    { "id": "runic-assets", "repository": "runic-assets", "path": "spec", "algorithm": "sha256-git-file-set-v1", "sha256": "51cb8c006db23c662f2721318efa96b38474f6addf7dc81608dda65583fde2d4" },
    { "id": "runic-translations", "repository": "runic-translations", "path": "spec", "algorithm": "sha256-git-file-set-v1", "sha256": "95c5e64c8dfd18b2b9e37ac1dbabb2833f9e81f647c32dd8a5122302b465c883" }
  ],
  "packages": [
    { "ecosystem": "nuget", "identity": "Runic.Application", "version": "1.0.0-preview.1", "source": "runic-toolkit" },
    { "ecosystem": "nuget", "identity": "Runic.Application.Bridge", "version": "1.0.0-preview.1", "source": "runic-toolkit" },
    { "ecosystem": "nuget", "identity": "Runic.Application.Desktop", "version": "1.0.0-preview.1", "source": "runic-toolkit" },
    { "ecosystem": "nuget", "identity": "Runic.Application.Hosting", "version": "1.0.0-preview.1", "source": "runic-toolkit" },
    { "ecosystem": "nuget", "identity": "Runic.Application.Testing", "version": "1.0.0-preview.1", "source": "runic-toolkit" },
    { "ecosystem": "nuget", "identity": "Runic.Application.Templates", "version": "1.0.0-preview.1", "source": "runic-toolkit" },
    { "ecosystem": "nuget", "identity": "dotnet-runic", "version": "1.0.0-preview.1", "source": "runic-toolkit" },
    { "ecosystem": "nuget", "identity": "Runic.CommandLine", "version": "1.0.0-preview.1", "source": "runic-command-line" },
    { "ecosystem": "nuget", "identity": "Runic.CommandLine.Processes", "version": "1.0.0-preview.1", "source": "runic-command-line" },
    { "ecosystem": "nuget", "identity": "Runic.CommandLine.Testing", "version": "1.0.0-preview.1", "source": "runic-command-line" },
    { "ecosystem": "nuget", "identity": "Runic.Assets", "version": "1.0.0-preview.1", "source": "runic-assets" },
    { "ecosystem": "nuget", "identity": "Runic.Assets.AspNetCore", "version": "1.0.0-preview.1", "source": "runic-assets" },
    { "ecosystem": "nuget", "identity": "Runic.Assets.Desktop", "version": "1.0.0-preview.1", "source": "runic-assets" },
    { "ecosystem": "nuget", "identity": "Runic.Translations", "version": "1.0.0-preview.1", "source": "runic-translations" },
    { "ecosystem": "nuget", "identity": "Runic.Translations.Tooling", "version": "1.0.0-preview.1", "source": "runic-translations" },
    { "ecosystem": "nuget", "identity": "Runic.Translations.Build", "version": "1.0.0-preview.1", "source": "runic-translations" },
    { "ecosystem": "nuget", "identity": "dotnet-runic-translations", "version": "1.0.0-preview.1", "source": "runic-translations" },
    { "ecosystem": "nuget", "identity": "Runic.Translations.Templates", "version": "1.0.0-preview.1", "source": "runic-translations" },
    { "ecosystem": "nuget", "identity": "Runic.Desktop", "version": "1.0.0-preview.1", "source": "runic-desktop" },
    { "ecosystem": "npm", "identity": "@runic-artifex/desktop", "version": "1.0.0-preview.1", "source": "runic-desktop" },
    { "ecosystem": "npm", "identity": "@runic-artifex/application-bridge", "version": "1.0.0-preview.1", "source": "runic-toolkit" },
    { "ecosystem": "npm", "identity": "@runic-artifex/angular", "version": "1.0.0-preview.1", "source": "runic-toolkit" },
    { "ecosystem": "npm", "identity": "@runic-artifex/vite-plugin-runic-translations", "version": "1.0.0-preview.1", "source": "runic-translations" },
    { "ecosystem": "npm", "identity": "@runic-artifex/svelte", "version": "1.0.0-preview.1", "source": "runic-svelte" },
    { "ecosystem": "npm", "identity": "@runic-artifex/sveltekit", "version": "1.0.0-preview.1", "source": "runic-svelte" },
    { "ecosystem": "npm", "identity": "@runic-artifex/vite-plugin-runic", "version": "1.0.0-preview.1", "source": "runic-vite" }
  ]
}
